{
  "id": "7d0a0040-2026-4000-8000-000000000001",
  "name": "TN - DO · A4 40 câu",
  "code": "TNDO-A40",
  "version": 1,
  "width": 1200,
  "height": 1697,
  "anchors": [
    {
      "x": 0.035,
      "y": 0.025
    },
    {
      "x": 0.965,
      "y": 0.025
    },
    {
      "x": 0.965,
      "y": 0.975
    },
    {
      "x": 0.035,
      "y": 0.975
    }
  ],
  "questions": [
    {
      "number": 1,
      "section": "mcq",
      "bubbles": [
        {
          "label": "A",
          "x": 0.12,
          "y": 0.395,
          "radius": 0.0085
        },
        {
          "label": "B",
          "x": 0.154,
          "y": 0.395,
          "radius": 0.0085
        },
        {
          "label": "C",
          "x": 0.188,
          "y": 0.395,
          "radius": 0.0085
        },
        {
          "label": "D",
          "x": 0.222,
          "y": 0.395,
          "radius": 0.0085
        }
      ]
    },
    {
      "number": 2,
      "section": "mcq",
      "bubbles": [
        {
          "label": "A",
          "x": 0.12,
          "y": 0.4311111111111111,
          "radius": 0.0085
        },
        {
          "label": "B",
          "x": 0.154,
          "y": 0.4311111111111111,
          "radius": 0.0085
        },
        {
          "label": "C",
          "x": 0.188,
          "y": 0.4311111111111111,
          "radius": 0.0085
        },
        {
          "label": "D",
          "x": 0.222,
          "y": 0.4311111111111111,
          "radius": 0.0085
        }
      ]
    },
    {
      "number": 3,
      "section": "mcq",
      "bubbles": [
        {
          "label": "A",
          "x": 0.12,
          "y": 0.46722222222222226,
          "radius": 0.0085
        },
        {
          "label": "B",
          "x": 0.154,
          "y": 0.46722222222222226,
          "radius": 0.0085
        },
        {
          "label": "C",
          "x": 0.188,
          "y": 0.46722222222222226,
          "radius": 0.0085
        },
        {
          "label": "D",
          "x": 0.222,
          "y": 0.46722222222222226,
          "radius": 0.0085
        }
      ]
    },
    {
      "number": 4,
      "section": "mcq",
      "bubbles": [
        {
          "label": "A",
          "x": 0.12,
          "y": 0.5033333333333334,
          "radius": 0.0085
        },
        {
          "label": "B",
          "x": 0.154,
          "y": 0.5033333333333334,
          "radius": 0.0085
        },
        {
          "label": "C",
          "x": 0.188,
          "y": 0.5033333333333334,
          "radius": 0.0085
        },
        {
          "label": "D",
          "x": 0.222,
          "y": 0.5033333333333334,
          "radius": 0.0085
        }
      ]
    },
    {
      "number": 5,
      "section": "mcq",
      "bubbles": [
        {
          "label": "A",
          "x": 0.12,
          "y": 0.5394444444444445,
          "radius": 0.0085
        },
        {
          "label": "B",
          "x": 0.154,
          "y": 0.5394444444444445,
          "radius": 0.0085
        },
        {
          "label": "C",
          "x": 0.188,
          "y": 0.5394444444444445,
          "radius": 0.0085
        },
        {
          "label": "D",
          "x": 0.222,
          "y": 0.5394444444444445,
          "radius": 0.0085
        }
      ]
    },
    {
      "number": 6,
      "section": "mcq",
      "bubbles": [
        {
          "label": "A",
          "x": 0.12,
          "y": 0.5755555555555556,
          "radius": 0.0085
        },
        {
          "label": "B",
          "x": 0.154,
          "y": 0.5755555555555556,
          "radius": 0.0085
        },
        {
          "label": "C",
          "x": 0.188,
          "y": 0.5755555555555556,
          "radius": 0.0085
        },
        {
          "label": "D",
          "x": 0.222,
          "y": 0.5755555555555556,
          "radius": 0.0085
        }
      ]
    },
    {
      "number": 7,
      "section": "mcq",
      "bubbles": [
        {
          "label": "A",
          "x": 0.12,
          "y": 0.6116666666666667,
          "radius": 0.0085
        },
        {
          "label": "B",
          "x": 0.154,
          "y": 0.6116666666666667,
          "radius": 0.0085
        },
        {
          "label": "C",
          "x": 0.188,
          "y": 0.6116666666666667,
          "radius": 0.0085
        },
        {
          "label": "D",
          "x": 0.222,
          "y": 0.6116666666666667,
          "radius": 0.0085
        }
      ]
    },
    {
      "number": 8,
      "section": "mcq",
      "bubbles": [
        {
          "label": "A",
          "x": 0.12,
          "y": 0.6477777777777778,
          "radius": 0.0085
        },
        {
          "label": "B",
          "x": 0.154,
          "y": 0.6477777777777778,
          "radius": 0.0085
        },
        {
          "label": "C",
          "x": 0.188,
          "y": 0.6477777777777778,
          "radius": 0.0085
        },
        {
          "label": "D",
          "x": 0.222,
          "y": 0.6477777777777778,
          "radius": 0.0085
        }
      ]
    },
    {
      "number": 9,
      "section": "mcq",
      "bubbles": [
        {
          "label": "A",
          "x": 0.12,
          "y": 0.683888888888889,
          "radius": 0.0085
        },
        {
          "label": "B",
          "x": 0.154,
          "y": 0.683888888888889,
          "radius": 0.0085
        },
        {
          "label": "C",
          "x": 0.188,
          "y": 0.683888888888889,
          "radius": 0.0085
        },
        {
          "label": "D",
          "x": 0.222,
          "y": 0.683888888888889,
          "radius": 0.0085
        }
      ]
    },
    {
      "number": 10,
      "section": "mcq",
      "bubbles": [
        {
          "label": "A",
          "x": 0.12,
          "y": 0.72,
          "radius": 0.0085
        },
        {
          "label": "B",
          "x": 0.154,
          "y": 0.72,
          "radius": 0.0085
        },
        {
          "label": "C",
          "x": 0.188,
          "y": 0.72,
          "radius": 0.0085
        },
        {
          "label": "D",
          "x": 0.222,
          "y": 0.72,
          "radius": 0.0085
        }
      ]
    },
    {
      "number": 11,
      "section": "mcq",
      "bubbles": [
        {
          "label": "A",
          "x": 0.33999999999999997,
          "y": 0.395,
          "radius": 0.0085
        },
        {
          "label": "B",
          "x": 0.374,
          "y": 0.395,
          "radius": 0.0085
        },
        {
          "label": "C",
          "x": 0.408,
          "y": 0.395,
          "radius": 0.0085
        },
        {
          "label": "D",
          "x": 0.44199999999999995,
          "y": 0.395,
          "radius": 0.0085
        }
      ]
    },
    {
      "number": 12,
      "section": "mcq",
      "bubbles": [
        {
          "label": "A",
          "x": 0.33999999999999997,
          "y": 0.4311111111111111,
          "radius": 0.0085
        },
        {
          "label": "B",
          "x": 0.374,
          "y": 0.4311111111111111,
          "radius": 0.0085
        },
        {
          "label": "C",
          "x": 0.408,
          "y": 0.4311111111111111,
          "radius": 0.0085
        },
        {
          "label": "D",
          "x": 0.44199999999999995,
          "y": 0.4311111111111111,
          "radius": 0.0085
        }
      ]
    },
    {
      "number": 13,
      "section": "mcq",
      "bubbles": [
        {
          "label": "A",
          "x": 0.33999999999999997,
          "y": 0.46722222222222226,
          "radius": 0.0085
        },
        {
          "label": "B",
          "x": 0.374,
          "y": 0.46722222222222226,
          "radius": 0.0085
        },
        {
          "label": "C",
          "x": 0.408,
          "y": 0.46722222222222226,
          "radius": 0.0085
        },
        {
          "label": "D",
          "x": 0.44199999999999995,
          "y": 0.46722222222222226,
          "radius": 0.0085
        }
      ]
    },
    {
      "number": 14,
      "section": "mcq",
      "bubbles": [
        {
          "label": "A",
          "x": 0.33999999999999997,
          "y": 0.5033333333333334,
          "radius": 0.0085
        },
        {
          "label": "B",
          "x": 0.374,
          "y": 0.5033333333333334,
          "radius": 0.0085
        },
        {
          "label": "C",
          "x": 0.408,
          "y": 0.5033333333333334,
          "radius": 0.0085
        },
        {
          "label": "D",
          "x": 0.44199999999999995,
          "y": 0.5033333333333334,
          "radius": 0.0085
        }
      ]
    },
    {
      "number": 15,
      "section": "mcq",
      "bubbles": [
        {
          "label": "A",
          "x": 0.33999999999999997,
          "y": 0.5394444444444445,
          "radius": 0.0085
        },
        {
          "label": "B",
          "x": 0.374,
          "y": 0.5394444444444445,
          "radius": 0.0085
        },
        {
          "label": "C",
          "x": 0.408,
          "y": 0.5394444444444445,
          "radius": 0.0085
        },
        {
          "label": "D",
          "x": 0.44199999999999995,
          "y": 0.5394444444444445,
          "radius": 0.0085
        }
      ]
    },
    {
      "number": 16,
      "section": "mcq",
      "bubbles": [
        {
          "label": "A",
          "x": 0.33999999999999997,
          "y": 0.5755555555555556,
          "radius": 0.0085
        },
        {
          "label": "B",
          "x": 0.374,
          "y": 0.5755555555555556,
          "radius": 0.0085
        },
        {
          "label": "C",
          "x": 0.408,
          "y": 0.5755555555555556,
          "radius": 0.0085
        },
        {
          "label": "D",
          "x": 0.44199999999999995,
          "y": 0.5755555555555556,
          "radius": 0.0085
        }
      ]
    },
    {
      "number": 17,